3,Roasted Chicken Noodles with Shrimp Wanton,80.00,Noodles / Vegetables / Roasted Chicken / Shrimp Wanton
4,Shrimp Noodles with Egg,90.00,Noodles / Vegetables / Shrimp / Egg
5,Crab Noodles with Shrimp Wanton,100.00,Noodles / Vegetables / Crab / Shrimp Wanton
6,All In One Non-Seafood,150.00,Noodles / Vegetables / Roasted Pork/ Roasted Chicken / Minced Pork/ Crispy Pork / Shrimp Wanton / Pork W7
7,Crispy Pork Noodle with Pork Wanton,80.00,Noodles / Vegetables / Crispy Pork / Pork Wanton
8,Minced Pork Noodles with Pork Wanton,70.00,Noodles / Vegetables / Minced Pork / Pork Wanton
